Entry	Reviewed	Entry name	Protein names	Gene names	Organism	Length	Gene names (primary)
Q96RP9	reviewed	EFGM_HUMAN	Elongation factor G, mitochondrial (EF-Gmt) (Elongation factor G 1, mitochondrial) (mEF-G 1) (Elongation factor G1) (hEFG1)	GFM1 EFG EFG1 GFM	Homo sapiens (Human)	751	GFM1
P07242	reviewed	PG110_VACCW	Late transcription elongation factor OPG110 (Viral late gene transcription factor 4) (VLTF-4)	OPG110 VACWR103 H5R	Vaccinia virus (strain Western Reserve) (VACV) (Vaccinia virus (strain WR))	203	OPG110
P57772	reviewed	SELB_HUMAN	Selenocysteine-specific elongation factor (Elongation factor sec) (Eukaryotic elongation factor, selenocysteine-tRNA-specific)	EEFSEC SELB	Homo sapiens (Human)	596	EEFSEC
Q7Z2Z2	reviewed	EFL1_HUMAN	Elongation factor-like GTPase 1 (Elongation factor Tu GTP-binding domain-containing protein 1) (Elongation factor-like 1) (Protein FAM42A)	EFL1 EFTUD1 FAM42A	Homo sapiens (Human)	1120	EFL1
P13639	reviewed	EF2_HUMAN	Elongation factor 2 (EF-2) (EC 3.6.5.-)	EEF2 EF2	Homo sapiens (Human)	858	EEF2
P49411	reviewed	EFTU_HUMAN	Elongation factor Tu, mitochondrial (EF-Tu) (P43)	TUFM	Homo sapiens (Human)	455	TUFM
P68104	reviewed	EF1A1_HUMAN	Elongation factor 1-alpha 1 (EF-1-alpha-1) (EC 3.6.5.-) (Elongation factor Tu) (EF-Tu) (Eukaryotic elongation factor 1 A-1) (eEF1A-1) (Leukocyte receptor cluster member 7)	EEF1A1 EEF1A EF1A LENG7	Homo sapiens (Human)	462	EEF1A1
P23193	reviewed	TCEA1_HUMAN	Transcription elongation factor A protein 1 (Transcription elongation factor S-II protein 1) (Transcription elongation factor TFIIS.o)	TCEA1 GTF2S TFIIS	Homo sapiens (Human)	301	TCEA1
P16521	reviewed	EF3A_YEAST	Elongation factor 3A (EF-3) (EF-3A) (EC 3.6.4.-) (Eukaryotic elongation factor 3) (eEF3) (Translation elongation factor 3A) (Yeast elongation factor 3)	YEF3 EFC1 TEF3 YEF3A YLR249W L9672.5	Saccharomyces cerevisiae (strain ATCC 204508 / S288c) (Baker's yeast)	1044	YEF3
P43897	reviewed	EFTS_HUMAN	Elongation factor Ts, mitochondrial (EF-Ts) (EF-TsMt)	TSFM	Homo sapiens (Human)	325	TSFM
P24534	reviewed	EF1B_HUMAN	Elongation factor 1-beta (EF-1-beta)	EEF1B2 EEF1B EF1B	Homo sapiens (Human)	225	EEF1B2
Q05639	reviewed	EF1A2_HUMAN	Elongation factor 1-alpha 2 (EF-1-alpha-2) (Eukaryotic elongation factor 1 A-2) (eEF1A-2) (Statin-S1)	EEF1A2 EEF1AL STN	Homo sapiens (Human)	463	EEF1A2
Q96QE5	reviewed	TEFM_HUMAN	Transcription elongation factor, mitochondrial	TEFM C17orf42	Homo sapiens (Human)	360	TEFM
P32471	reviewed	EF1B_YEAST	Elongation factor 1-beta (EF-1-beta) (Eukaryotic elongation factor 1Balpha) (eEF1Balpha) (Translation elongation factor 1B alpha)	EFB1 TEF5 YAL003W	Saccharomyces cerevisiae (strain ATCC 204508 / S288c) (Baker's yeast)	206	EFB1
Q15560	reviewed	TCEA2_HUMAN	Transcription elongation factor A protein 2 (Testis-specific S-II) (Transcription elongation factor S-II protein 2) (Transcription elongation factor TFIIS.l)	TCEA2	Homo sapiens (Human)	299	TCEA2
P32324	reviewed	EF2_YEAST	Elongation factor 2 (EF-2) (EC 3.6.5.-) (Eukaryotic elongation factor 2) (eEF2) (Ribosomal translocase) (Translation elongation factor 2)	EFT1 YOR133W O3317 YOR3317W; EFT2 YDR385W	Saccharomyces cerevisiae (strain ATCC 204508 / S288c) (Baker's yeast)	842	EFT1; EFT2
P02994	reviewed	EF1A_YEAST	Elongation factor 1-alpha (EF-1-alpha) (Eukaryotic elongation factor 1A) (eEF1A) (Translation elongation factor 1A)	TEF1 YPR080W P9513.7; TEF2 YBR118W YBR0913	Saccharomyces cerevisiae (strain ATCC 204508 / S288c) (Baker's yeast)	458	TEF1; TEF2
P32914	reviewed	SPT4_YEAST	Transcription elongation factor SPT4 (Chromatin elongation factor SPT4)	SPT4 YGR063C	Saccharomyces cerevisiae (strain ATCC 204508 / S288c) (Baker's yeast)	102	SPT4
Q9JHW4	reviewed	SELB_MOUSE	Selenocysteine-specific elongation factor (Elongation factor sec) (Eukaryotic elongation factor, selenocysteine-tRNA-specific) (mSelB)	Eefsec Selb	Mus musculus (Mouse)	583	Eefsec
P58252	reviewed	EF2_MOUSE	Elongation factor 2 (EF-2) (EC 3.6.5.-)	Eef2	Mus musculus (Mouse)	858	Eef2
Q3SYU2	reviewed	EF2_BOVIN	Elongation factor 2 (EF-2) (EC 3.6.5.-)	EEF2	Bos taurus (Bovine)	858	EEF2
Q969S9	reviewed	RRF2M_HUMAN	Ribosome-releasing factor 2, mitochondrial (RRF2mt) (EC 3.6.5.-) (Elongation factor G 2, mitochondrial) (EF-G2mt) (mEF-G 2) (Elongation factor G2) (hEFG2)	GFM2 EFG2 MSTP027	Homo sapiens (Human)	779	GFM2
P05197	reviewed	EF2_RAT	Elongation factor 2 (EF-2) (EC 3.6.5.-)	Eef2	Rattus norvegicus (Rat)	858	Eef2
O00472	reviewed	ELL2_HUMAN	RNA polymerase II elongation factor ELL2	ELL2	Homo sapiens (Human)	640	ELL2
Q9HB65	reviewed	ELL3_HUMAN	RNA polymerase II elongation factor ELL3	ELL3	Homo sapiens (Human)	397	ELL3
P10126	reviewed	EF1A1_MOUSE	Elongation factor 1-alpha 1 (EF-1-alpha-1) (EC 3.6.5.-) (Elongation factor Tu) (EF-Tu) (Eukaryotic elongation factor 1 A-1) (eEF1A-1)	Eef1a1 Eef1a	Mus musculus (Mouse)	462	Eef1a1
P62630	reviewed	EF1A1_RAT	Elongation factor 1-alpha 1 (EF-1-alpha-1) (EC 3.6.5.-) (Elongation factor Tu) (EF-Tu) (Eukaryotic elongation factor 1 A-1) (eEF1A-1)	Eef1a1 Eef1a	Rattus norvegicus (Rat)	462	Eef1a1
P26641	reviewed	EF1G_HUMAN	Elongation factor 1-gamma (EF-1-gamma) (eEF-1B gamma)	EEF1G EF1G PRO1608	Homo sapiens (Human)	437	EEF1G
P68103	reviewed	EF1A1_BOVIN	Elongation factor 1-alpha 1 (EF-1-alpha-1) (EC 3.6.5.-) (Elongation factor Tu) (EF-Tu) (Eukaryotic elongation factor 1 A-1) (eEF1A-1)	EEF1A1 EEF1A EF1A	Bos taurus (Bovine)	462	EEF1A1
P29692	reviewed	EF1D_HUMAN	Elongation factor 1-delta (EF-1-delta) (Antigen NY-CO-4)	EEF1D EF1D	Homo sapiens (Human)	281	EEF1D
P53978	reviewed	EF3B_YEAST	Elongation factor 3B (EF-3B) (EC 3.6.4.-) (Homolog of EF-3) (Translation elongation factor 3B)	HEF3 YEF3B ZRG7 YNL014W N2846	Saccharomyces cerevisiae (strain ATCC 204508 / S288c) (Baker's yeast)	1044	HEF3
P27692	reviewed	SPT5_YEAST	Transcription elongation factor SPT5 (Chromatin elongation factor SPT5)	SPT5 YML010W YM9571.08	Saccharomyces cerevisiae (strain ATCC 204508 / S288c) (Baker's yeast)	1063	SPT5
O00418	reviewed	EF2K_HUMAN	Eukaryotic elongation factor 2 kinase (eEF-2 kinase) (eEF-2K) (EC 2.7.11.20) (Calcium/calmodulin-dependent eukaryotic elongation factor 2 kinase)	EEF2K	Homo sapiens (Human)	725	EEF2K
P02992	reviewed	EFTU_YEAST	Elongation factor Tu, mitochondrial (tufM)	TUF1 TUFM YOR187W	Saccharomyces cerevisiae (strain ATCC 204508 / S288c) (Baker's yeast)	437	TUF1
P0A6N4	reviewed	EFP_ECOLI	Elongation factor P (EF-P)	efp b4147 JW4107	Escherichia coli (strain K12)	188	efp
P23615	reviewed	SPT6_YEAST	Transcription elongation factor SPT6 (Chromatin elongation factor SPT6)	SPT6 CRE2 SSN20 YGR116W G6169	Saccharomyces cerevisiae (strain ATCC 204508 / S288c) (Baker's yeast)	1451	SPT6
P10711	reviewed	TCEA1_MOUSE	Transcription elongation factor A protein 1 (Transcription elongation factor S-II protein 1) (Transcription elongation factor TFIIS.o)	Tcea1 Tceat	Mus musculus (Mouse)	301	Tcea1
P29691	reviewed	EF2_CAEEL	Elongation factor 2 (EF-2) (EC 3.6.5.-)	eef-2 F25H5.4	Caenorhabditis elegans	852	eef-2
P57776	reviewed	EF1D_MOUSE	Elongation factor 1-delta (EF-1-delta)	Eef1d	Mus musculus (Mouse)	281	Eef1d
P32769	reviewed	HBS1_YEAST	Elongation factor 1 alpha-like protein (EC 3.6.5.-)	HBS1 YKR084C YKR404	Saccharomyces cerevisiae (strain ATCC 204508 / S288c) (Baker's yeast)	611	HBS1
P0A6M8	reviewed	EFG_ECOLI	Elongation factor G (EF-G) (EC 3.6.5.-)	fusA far fus b3340 JW3302	Escherichia coli (strain K12)	704	fusA
O14776	reviewed	TCRG1_HUMAN	Transcription elongation regulator 1 (TATA box-binding protein-associated factor 2S) (Transcription factor CA150)	TCERG1 CA150 TAF2S	Homo sapiens (Human)	1098	TCERG1
P14081	reviewed	SELB_ECOLI	Selenocysteine-specific elongation factor (SelB translation factor)	selB fdhA b3590 JW3563	Escherichia coli (strain K12)	614	selB
Q969K4	reviewed	ABTB1_HUMAN	Ankyrin repeat and BTB/POZ domain-containing protein 1 (Elongation factor 1A-binding protein)	ABTB1 BPOZ PP2259	Homo sapiens (Human)	478	ABTB1
Q9SI75	reviewed	EFGC_ARATH	Elongation factor G, chloroplastic (cEF-G) (Elongation factor EF-G/SCO1) (Protein SNOWY COTYLEDON 1, chloroplastic) (AtSCO1)	CPEFG SCO1 At1g62750 F23N19.11	Arabidopsis thaliana (Mouse-ear cress)	783	CPEFG
P62631	reviewed	EF1A2_MOUSE	Elongation factor 1-alpha 2 (EF-1-alpha-2) (Eukaryotic elongation factor 1 A-2) (eEF1A-2) (Statin-S1)	Eef1a2 Eef1al Stn	Mus musculus (Mouse)	463	Eef1a2
Q9W420	reviewed	SPT6H_DROME	Transcription elongation factor SPT6	Spt6 CG12225	Drosophila melanogaster (Fruit fly)	1831	Spt6
P63272	reviewed	SPT4H_HUMAN	Transcription elongation factor SPT4 (hSPT4) (DRB sensitivity-inducing factor 14 kDa subunit) (DSIF p14) (DRB sensitivity-inducing factor small subunit) (DSIF small subunit)	SUPT4H1 SPT4H SUPT4H	Homo sapiens (Human)	117	SUPT4H1
P62632	reviewed	EF1A2_RAT	Elongation factor 1-alpha 2 (EF-1-alpha-2) (Eukaryotic elongation factor 1 A-2) (eEF1A-2) (Statin-S1)	Eef1a2 Eef1al Stn Stnl	Rattus norvegicus (Rat)	463	Eef1a2
Q9GRF8	reviewed	EF1B_DICDI	Elongation factor 1-beta (DdEF-1 beta)	efa1B eEF1beta DDB_G0284035	Dictyostelium discoideum (Social amoeba)	216	efa1B
A8MS85	reviewed	SPT61_ARATH	Transcription elongation factor SPT6 homolog (AtSPT6)	SPT6 GTB1 SPT6L At1g65440 T8F5.22	Arabidopsis thaliana (Mouse-ear cress)	1647	SPT6
P29547	reviewed	EF1G1_YEAST	Elongation factor 1-gamma 1 (EF-1-gamma 1) (Calcium and membrane-binding protein 1) (Calcium phospholipid-binding protein) (CPBP) (Eukaryotic elongation factor 1Bgamma 1) (eEF1Bgamma 1) (Translation elongation factor 1B gamma 1)	CAM1 TEF3 YPL048W	Saccharomyces cerevisiae (strain ATCC 204508 / S288c) (Baker's yeast)	415	CAM1
Q9QVN7	reviewed	TCEA2_MOUSE	Transcription elongation factor A protein 2 (Protein S-II-T1) (Testis-specific S-II) (Transcription elongation factor S-II protein 2) (Transcription elongation factor TFIIS.l)	Tcea2	Mus musculus (Mouse)	299	Tcea2
Q9ZVH8	reviewed	RDO2_ARATH	Transcription elongation factor TFIIS (Protein REDUCED DORMANCY 2)	TFIIS RDO2 At2g38560	Arabidopsis thaliana (Mouse-ear cress)	378	TFIIS
A2Q0Z0	reviewed	EF1A1_HORSE	Elongation factor 1-alpha 1 (EF-1-alpha-1) (EC 3.6.5.-) (Elongation factor Tu) (EF-Tu) (Eukaryotic elongation factor 1 A-1) (eEF1A-1)	EEF1A1	Equus caballus (Horse)	462	EEF1A1
P55823	reviewed	EF2_RABIT	Elongation factor 2 (EF-2) (EC 3.6.5.-)	EEF2	Oryctolagus cuniculus (Rabbit)	857	EEF2
Q8IYF1	reviewed	ELOA2_HUMAN	Elongin-A2 (EloA2) (RNA polymerase II transcription factor SIII subunit A2) (Transcription elongation factor B polypeptide 3B)	ELOA2 TCEB3B TCEB3L	Homo sapiens (Human)	753	ELOA2
Q86NP2	reviewed	NELFA_DROME	Negative elongation factor A	Nelf-A CG5874	Drosophila melanogaster (Fruit fly)	1251	Nelf-A
P62629	reviewed	EF1A1_CRIGR	Elongation factor 1-alpha 1 (EF-1-alpha-1) (EC 3.6.5.-) (Elongation factor Tu) (EF-Tu) (Eukaryotic elongation factor 1 A-1) (eEF1A-1)	EEF1A1 EEF1A	Cricetulus griseus (Chinese hamster) (Cricetulus barabensis griseus)	462	EEF1A1
Q5R1X2	reviewed	EF1A1_PANTR	Elongation factor 1-alpha 1 (EF-1-alpha-1) (EC 3.6.5.-) (Elongation factor Tu) (EF-Tu) (Eukaryotic elongation factor 1 A-1) (eEF1A-1)	EEF1A1 EEF1A	Pan troglodytes (Chimpanzee)	462	EEF1A1
Q62383	reviewed	SPT6H_MOUSE	Transcription elongation factor SPT6	Supt6h Kiaa0162 Supt6	Mus musculus (Mouse)	1726	Supt6h
Q66RN5	reviewed	EF1A1_FELCA	Elongation factor 1-alpha 1 (EF-1-alpha-1) (EC 3.6.5.-) (Elongation factor Tu) (EF-Tu) (Eukaryotic elongation factor 1 A-1) (eEF1A-1)	EEF1A1 EEF1A	Felis catus (Cat) (Felis silvestris catus)	462	EEF1A1
Q5R4R8	reviewed	EF1A1_PONAB	Elongation factor 1-alpha 1 (EF-1-alpha-1) (EC 3.6.5.-) (Elongation factor Tu) (EF-Tu) (Eukaryotic elongation factor 1 A-1) (eEF1A-1)	EEF1A1 EEF1A	Pongo abelii (Sumatran orangutan) (Pongo pygmaeus abelii)	462	EEF1A1
Q15170	reviewed	TCAL1_HUMAN	Transcription elongation factor A protein-like 1 (TCEA-like protein 1) (Nuclear phosphoprotein p21/SIIR) (Transcription elongation factor S-II protein-like 1)	TCEAL1 SIIR	Homo sapiens (Human)	159	TCEAL1
P68105	reviewed	EF1A1_RABIT	Elongation factor 1-alpha 1 (EF-1-alpha-1) (EC 3.6.5.-) (Elongation factor Tu) (EF-Tu) (Eukaryotic elongation factor 1 A-1) (eEF1A-1)	EEF1A1 EEF1A EF1A	Oryctolagus cuniculus (Rabbit)	462	EEF1A1
Q8WX92	reviewed	NELFB_HUMAN	Negative elongation factor B (NELF-B) (Cofactor of BRCA1)	NELFB COBRA1 KIAA1182	Homo sapiens (Human)	580	NELFB
O13936	reviewed	SPT5_SCHPO	Transcription elongation factor spt5 (Chromatin elongation factor spt5)	spt5 SPAC23C4.19	Schizosaccharomyces pombe (strain 972 / ATCC 24843) (Fission yeast)	990	spt5
O43324	reviewed	MCA3_HUMAN	Eukaryotic translation elongation factor 1 epsilon-1 (Aminoacyl tRNA synthetase complex-interacting multifunctional protein 3) (Elongation factor p18) (Multisynthase complex auxiliary component p18)	EEF1E1 AIMP3 P18	Homo sapiens (Human)	174	EEF1E1
Q24134	reviewed	NELFD_DROME	Negative elongation factor D	TH1 NELF-D CG9984	Drosophila melanogaster (Fruit fly)	578	TH1
P09445	reviewed	EF2_CRIGR	Elongation factor 2 (EF-2) (EC 3.6.5.-)	EEF2 EF2	Cricetulus griseus (Chinese hamster) (Cricetulus barabensis griseus)	858	EEF2
P70531	reviewed	EF2K_RAT	Eukaryotic elongation factor 2 kinase (eEF-2 kinase) (eEF-2K) (EC 2.7.11.20) (Calcium/calmodulin-dependent eukaryotic elongation factor 2 kinase)	Eef2k	Rattus norvegicus (Rat)	724	Eef2k
Q9D1M4	reviewed	MCA3_MOUSE	Eukaryotic translation elongation factor 1 epsilon-1 (Elongation factor p18) (Multisynthase complex auxiliary component p18)	Eef1e1	Mus musculus (Mouse)	174	Eef1e1
Q80VR2	reviewed	ELL3_MOUSE	RNA polymerase II elongation factor ELL3	Ell3	Mus musculus (Mouse)	395	Ell3
P18615	reviewed	NELFE_HUMAN	Negative elongation factor E (NELF-E) (RNA-binding protein RD)	NELFE RD RDBP	Homo sapiens (Human)	380	NELFE
O00267	reviewed	SPT5H_HUMAN	Transcription elongation factor SPT5 (hSPT5) (DRB sensitivity-inducing factor 160 kDa subunit) (DSIF p160) (DRB sensitivity-inducing factor large subunit) (DSIF large subunit) (Tat-cotransactivator 1 protein) (Tat-CT1 protein)	SUPT5H SPT5 SPT5H	Homo sapiens (Human)	1087	SUPT5H
P92204	reviewed	NELFE_DROME	Negative elongation factor E	Nelf-E anon-66Da CG5994	Drosophila melanogaster (Fruit fly)	280	Nelf-E
O08796	reviewed	EF2K_MOUSE	Eukaryotic elongation factor 2 kinase (eEF-2 kinase) (eEF-2K) (EC 2.7.11.20) (Calcium/calmodulin-dependent eukaryotic elongation factor 2 kinase)	Eef2k	Mus musculus (Mouse)	724	Eef2k
P55199	reviewed	ELL_HUMAN	RNA polymerase II elongation factor ELL (Eleven-nineteen lysine-rich leukemia protein)	ELL C19orf17	Homo sapiens (Human)	621	ELL
O94489	reviewed	EF3_SCHPO	Elongation factor 3 (EF-3) (EC 3.6.4.-)	tef3 ef3 SPCC417.08	Schizosaccharomyces pombe (strain 972 / ATCC 24843) (Fission yeast)	1047	tef3
Q0WL56	reviewed	EF1A3_ARATH	Elongation factor 1-alpha 3 (EF-1-alpha 3) (eEF-1A3)	A3 At1g07920 T6D22.2	Arabidopsis thaliana (Mouse-ear cress)	449	A3
O55201	reviewed	SPT5H_MOUSE	Transcription elongation factor SPT5 (DRB sensitivity-inducing factor large subunit) (DSIF large subunit)	Supt5h Supt5	Mus musculus (Mouse)	1082	Supt5h
Q8IXH7	reviewed	NELFD_HUMAN	Negative elongation factor C/D (NELF-C/D) (TH1-like protein)	NELFCD NELFD TH1 TH1L HSPC130	Homo sapiens (Human)	590	NELFCD
O01991	reviewed	EF2K_CAEEL	Eukaryotic elongation factor 2 kinase (eEF-2 kinase) (eEF-2K) (EC 2.7.11.20) (Calcium/calmodulin-dependent eukaryotic elongation factor 2 kinase)	efk-1 F42A10.4	Caenorhabditis elegans	768	efk-1
Q8GTY0	reviewed	EF1A4_ARATH	Elongation factor 1-alpha 4 (EF-1-alpha 4) (eEF-1A4)	A4 EF1A At5g60390 MUF9.4	Arabidopsis thaliana (Mouse-ear cress)	449	A4
Q15370	reviewed	ELOB_HUMAN	Elongin-B (EloB) (Elongin 18 kDa subunit) (RNA polymerase II transcription factor SIII subunit B) (SIII p18) (Transcription elongation factor B polypeptide 2)	ELOB TCEB2	Homo sapiens (Human)	118	ELOB
Q15369	reviewed	ELOC_HUMAN	Elongin-C (EloC) (Elongin 15 kDa subunit) (RNA polymerase II transcription factor SIII subunit C) (SIII p15) (Transcription elongation factor B polypeptide 1)	ELOC TCEB1	Homo sapiens (Human)	112	ELOC
Q8UVK2	reviewed	SPT6H_DANRE	Transcription elongation factor SPT6 (Protein pandora)	supt6h pan spt6	Danio rerio (Zebrafish) (Brachydanio rerio)	1726	supt6h
Q5ALX3	reviewed	SPT5_CANAL	Transcription elongation factor SPT5 (Chromatin elongation factor SPT5)	SPT5 CAALFM_C201480WA CaO19.1453 CaO19.9028	Candida albicans (strain SC5314 / ATCC MYA-2876) (Yeast)	956	SPT5
Q14241	reviewed	ELOA1_HUMAN	Elongin-A (EloA) (Elongin 110 kDa subunit) (RNA polymerase II transcription factor SIII subunit A1) (SIII p110) (Transcription elongation factor B polypeptide 3)	ELOA TCEB3 MSTP059	Homo sapiens (Human)	772	ELOA
Q3MNT0	reviewed	SPT6_CANAL	Transcription elongation factor SPT6 (Chromatin elongation factor SPT6)	SPT6 CAALFM_C704300WA CaJ7.0509 CaO19.7136	Candida albicans (strain SC5314 / ATCC MYA-2876) (Yeast)	1401	SPT6
Q71V39	reviewed	EF1A2_RABIT	Elongation factor 1-alpha 2 (EF-1-alpha-2) (Eukaryotic elongation factor 1 A-2) (eEF1A-2) (Statin-S1)	EEF1A2	Oryctolagus cuniculus (Rabbit)	463	EEF1A2
Q9V460	reviewed	SPT5H_DROME	Transcription elongation factor SPT5 (DRB sensitivity-inducing factor large subunit) (DSIF large subunit) (dSpt5)	Spt5 CG7626	Drosophila melanogaster (Fruit fly)	1078	Spt5
Q9TVQ5	reviewed	SPT4H_DROME	Transcription elongation factor SPT4 (DRB sensitivity-inducing factor small subunit) (DSIF small subunit) (dSpt4)	spt4 CG12372	Drosophila melanogaster (Fruit fly)	116	spt4
Q5SHN6	reviewed	EFTU1_THET8	Elongation factor Tu-A (EF-Tu-A)	tufA tuf TTHA1694	Thermus thermophilus (strain ATCC 27634 / DSM 579 / HB8)	406	tufA
O74774	reviewed	HBS1_SCHPO	Elongation factor 1 alpha-like protein (EC 3.6.5.-)	hbs1 SPBC25B2.01 SPBC2G5.08	Schizosaccharomyces pombe (strain 972 / ATCC 24843) (Fission yeast)	592	hbs1
P46943	reviewed	GUF1_YEAST	Translation factor GUF1, mitochondrial (EC 3.6.5.-) (Elongation factor 4 homolog) (EF-4) (GTPase GUF1) (Ribosomal back-translocase)	GUF1 YLR289W L8003.7	Saccharomyces cerevisiae (strain ATCC 204508 / S288c) (Baker's yeast)	645	GUF1
P0A6P1	reviewed	EFTS_ECOLI	Elongation factor Ts (EF-Ts) (Bacteriophage Q beta RNA-directed RNA polymerase subunit IV)	tsf b0170 JW0165	Escherichia coli (strain K12)	283	tsf
Q9H3P2	reviewed	NELFA_HUMAN	Negative elongation factor A (NELF-A) (Wolf-Hirschhorn syndrome candidate 2 protein)	NELFA WHSC2 P/OKcl.15	Homo sapiens (Human)	528	NELFA
Q9ASR1	reviewed	EF2_ARATH	Elongation factor 2 (EF-2) (EC 3.6.5.-) (Protein LOW EXPRESSION OF OSMOTICALLY RESPONSIVE GENES 1)	LOS1 At1g56070/At1g56075 T6H22.13	Arabidopsis thaliana (Mouse-ear cress)	843	LOS1
P25997	reviewed	EF3_CANAL	Elongation factor 3 (EF-3) (EC 3.6.4.-)	CEF3 TEF3 CAALFM_C501580CA CaO19.11629 CaO19.4152	Candida albicans (strain SC5314 / ATCC MYA-2876) (Yeast)	1050	CEF3
Q9VW51	reviewed	ELL_DROME	RNA polymerase II elongation factor Ell (dELL)	Ell Su(Tpl) CG32217	Drosophila melanogaster (Fruit fly)	1059	Ell
P60785	reviewed	LEPA_ECOLI	Elongation factor 4 (EF-4) (EC 3.6.5.n1) (Ribosomal back-translocase LepA)	lepA b2569 JW2553	Escherichia coli (strain K12)	599	lepA
P0CT32	reviewed	EF1A2_DICDI	Elongation factor 1-alpha (EF-1-alpha) (50 kDa actin-binding protein) (ABP-50)	eef1a2 efaa2 efaAII DDB_G0269136	Dictyostelium discoideum (Social amoeba)	453	eef1a2
Q9DDT5	reviewed	SPT5H_DANRE	Transcription elongation factor SPT5 (DRB sensitivity-inducing factor large subunit) (DSIF large subunit) (Protein foggy)	supt5h fog spt5	Danio rerio (Zebrafish) (Brachydanio rerio)	1084	supt5h
P0CT31	reviewed	EF1A1_DICDI	Elongation factor 1-alpha (EF-1-alpha) (EC 3.6.5.-) (50 kDa actin-binding protein) (ABP-50)	eef1a1 efaa1 efaAI DDB_G0269134	Dictyostelium discoideum (Social amoeba)	453	eef1a1
P62870	reviewed	ELOB_RAT	Elongin-B (EloB) (Elongin 18 kDa subunit) (RNA polymerase II transcription factor SIII subunit B) (SIII p18) (Transcription elongation factor B polypeptide 2)	Elob Tceb2	Rattus norvegicus (Rat)	118	Elob
Q8N8B7	reviewed	TEANC_HUMAN	Transcription elongation factor A N-terminal and central domain-containing protein (TFIIS central domain-containing protein 1)	TCEANC	Homo sapiens (Human)	351	TCEANC
Q7KZ85	reviewed	SPT6H_HUMAN	Transcription elongation factor SPT6 (hSPT6) (Histone chaperone suppressor of Ty6) (Tat-cotransactivator 2 protein) (Tat-CT2 protein)	SUPT6H KIAA0162 SPT6H	Homo sapiens (Human)	1726	SUPT6H
F4K410	reviewed	SVR3_ARATH	Putative elongation factor TypA-like SVR3, chloroplastic (Protein HAPPY ON NORFLURAZON 23) (Protein SUPPRESSOR OF VARIEGATION 3)	SVR3 At5g13650 MSH12.11	Arabidopsis thaliana (Mouse-ear cress)	675	SVR3
P17745	reviewed	EFTU_ARATH	Elongation factor Tu, chloroplastic (EF-Tu) (Ras-related protein RABE1b) (AtRABE1b) (Ras-related protein Rab8D) (AtRab8D)	TUFA RAB8D RABE1B At4g20360 F9F13.10	Arabidopsis thaliana (Mouse-ear cress)	476	TUFA
P0CE48	reviewed	EFTU2_ECOLI	Elongation factor Tu 2 (EF-Tu 2) (Bacteriophage Q beta RNA-directed RNA polymerase subunit III) (P-43)	tufB b3980 JW3943	Escherichia coli (strain K12)	394	tufB
P0CE47	reviewed	EFTU1_ECOLI	Elongation factor Tu 1 (EF-Tu 1) (Bacteriophage Q beta RNA-directed RNA polymerase subunit III) (P-43)	tufA b3339 JW3301	Escherichia coli (strain K12)	394	tufA
Q6NKN9	reviewed	BH074_ARATH	Transcription factor bHLH74 (Basic helix-loop-helix protein 74) (AtbHLH74) (bHLH 74) (Protein ACTIVATOR FOR CELL ELONGATION 2) (Transcription factor EN 90) (bHLH transcription factor bHLH074)	BHLH74 ACE2 CIB4 EN90 At1g10120 T27I1.15	Arabidopsis thaliana (Mouse-ear cress)	366	BHLH74
O08856	reviewed	ELL_MOUSE	RNA polymerase II elongation factor ELL (Eleven-nineteen lysine-rich leukemia protein)	Ell	Mus musculus (Mouse)	602	Ell
Q8C4Y3	reviewed	NELFB_MOUSE	Negative elongation factor B (NELF-B) (Cofactor of BRCA1)	Nelfb Cobra1 MNCb-5210	Mus musculus (Mouse)	580	Nelfb
P63208	reviewed	SKP1_HUMAN	S-phase kinase-associated protein 1 (Cyclin-A/CDK2-associated protein p19) (p19A) (Organ of Corti protein 2) (OCP-2) (Organ of Corti protein II) (OCP-II) (RNA polymerase II elongation factor-like protein) (SIII) (Transcription elongation factor B polypeptide 1-like) (p19skp1)	SKP1 EMC19 OCP2 SKP1A TCEB1L	Homo sapiens (Human)	163	SKP1
Q8CGF7	reviewed	TCRG1_MOUSE	Transcription elongation regulator 1 (Formin-binding protein 28) (FBP 28) (TATA box-binding protein-associated factor 2S) (Transcription factor CA150) (p144)	Tcerg1 Taf2s	Mus musculus (Mouse)	1100	Tcerg1
P53893	reviewed	RIA1_YEAST	Ribosome assembly protein 1 (EC 3.6.5.-) (EF-2-like GTPase) (Elongation factor-like 1)	RIA1 EFL1 YNL163C N1718	Saccharomyces cerevisiae (strain ATCC 204508 / S288c) (Baker's yeast)	1110	RIA1
P19426	reviewed	NELFE_MOUSE	Negative elongation factor E (NELF-E) (RNA-binding protein RD)	Nelfe D17h6s45 Rd Rdbp	Mus musculus (Mouse)	375	Nelfe
Q8N1G1	reviewed	REXO1_HUMAN	RNA exonuclease 1 homolog (EC 3.1.-.-) (Elongin-A-binding protein 1) (EloA-BP1) (Transcription elongation factor B polypeptide 3-binding protein 1)	REXO1 ELOABP1 KIAA1138 TCEB3BP1	Homo sapiens (Human)	1221	REXO1
Q9UHB7	reviewed	AFF4_HUMAN	AF4/FMR2 family member 4 (ALL1-fused gene from chromosome 5q31 protein) (Protein AF-5q31) (Major CDK9 elongation factor-associated protein)	AFF4 AF5Q31 MCEF HSPC092	Homo sapiens (Human)	1163	AFF4
P62869	reviewed	ELOB_MOUSE	Elongin-B (EloB) (Elongin 18 kDa subunit) (RNA polymerase II transcription factor SIII subunit B) (SIII p18) (Transcription elongation factor B polypeptide 2)	Elob Tceb2	Mus musculus (Mouse)	118	Elob
Q63187	reviewed	ELOA1_RAT	Elongin-A (EloA) (Elongin 110 kDa subunit) (RNA polymerase II transcription factor SIII subunit A1) (SIII p110) (Transcription elongation factor B polypeptide 3)	Eloa Tceb3	Rattus norvegicus (Rat)	773	Eloa
Q15029	reviewed	U5S1_HUMAN	116 kDa U5 small nuclear ribonucleoprotein component (Elongation factor Tu GTP-binding domain-containing protein 2) (SNU114 homolog) (hSNU114) (U5 snRNP-specific protein, 116 kDa) (U5-116 kDa)	EFTUD2 KIAA0031 SNRP116	Homo sapiens (Human)	972	EFTUD2
Q9Y5B9	reviewed	SP16H_HUMAN	FACT complex subunit SPT16 (Chromatin-specific transcription elongation factor 140 kDa subunit) (FACT 140 kDa subunit) (FACTp140) (Facilitates chromatin transcription complex subunit SPT16) (hSPT16)	SUPT16H FACT140 FACTP140	Homo sapiens (Human)	1047	SUPT16H
O75764	reviewed	TCEA3_HUMAN	Transcription elongation factor A protein 3 (Transcription elongation factor S-II protein 3) (Transcription elongation factor TFIIS.h)	TCEA3 TFIISH	Homo sapiens (Human)	348	TCEA3
Q96C03	reviewed	MID49_HUMAN	Mitochondrial dynamics protein MID49 (Mitochondrial dynamics protein of 49 kDa) (Mitochondrial elongation factor 2) (Smith-Magenis syndrome chromosomal region candidate gene 7 protein)	MIEF2 MID49 SMCR7	Homo sapiens (Human)	454	MIEF2
Q9SZD6	reviewed	PETS_ARATH	Polyprotein of EF-Ts, chloroplastic (150 kDa pro-protein) (Protein EMBRYO DEFECTIVE 2726) [Cleaved into: Plastid-specific ribosomal protein-7, chloroplastic; Elongation factor Ts, chloroplastic (EF-Ts)]	PETs EFTS EMB2726 PSRP-7 At4g29060 F19B15.90	Arabidopsis thaliana (Mouse-ear cress)	953	PETs
Q8BG30	reviewed	NELFA_MOUSE	Negative elongation factor A (NELF-A) (Wolf-Hirschhorn syndrome candidate 2 homolog) (mWHSC2)	Nelfa Whsc2 Whsc2h	Mus musculus (Mouse)	530	Nelfa
Q5VTE0	reviewed	EF1A3_HUMAN	Putative elongation factor 1-alpha-like 3 (EF-1-alpha-like 3) (Eukaryotic elongation factor 1 A-like 3) (eEF1A-like 3) (Eukaryotic translation elongation factor 1 alpha-1 pseudogene 5)	EEF1A1P5 EEF1AL3	Homo sapiens (Human)	462	EEF1A1P5
P25039	reviewed	EFGM_YEAST	Elongation factor G, mitochondrial (EF-Gmt) (Elongation factor G 1, mitochondrial) (mEF-G 1) (Elongation factor G1)	MEF1 YLR069C L2195	Saccharomyces cerevisiae (strain ATCC 204508 / S288c) (Baker's yeast)	761	MEF1
Q8BFR5	reviewed	EFTU_MOUSE	Elongation factor Tu, mitochondrial	Tufm	Mus musculus (Mouse)	452	Tufm
Q9NQG6	reviewed	MID51_HUMAN	Mitochondrial dynamics protein MIEF1 (Mitochondrial dynamics protein of 51 kDa) (Mitochondrial elongation factor 1) (Smith-Magenis syndrome chromosomal region candidate gene 7 protein-like) (SMCR7-like protein)	MIEF1 MID51 SMCR7L	Homo sapiens (Human)	463	MIEF1
