Entry	Reviewed	Entry name	Protein names	Gene names	Organism	Length	Gene names (primary)
C1DQS0	reviewed	LEPA_AZOVD	Elongation factor 4 (EF-4) (EC 3.6.5.n1) (Ribosomal back-translocase LepA)	lepA Avin_13740	Azotobacter vinelandii (strain DJ / ATCC BAA-1303)	599	lepA
C3K6G8	reviewed	LEPA_PSEFS	Elongation factor 4 (EF-4) (EC 3.6.5.n1) (Ribosomal back-translocase LepA)	lepA PFLU_1058	Pseudomonas fluorescens (strain SBW25)	599	lepA
C3L5S2	reviewed	LEPA_BACAC	Elongation factor 4 (EF-4) (EC 3.6.5.n1) (Ribosomal back-translocase LepA)	lepA BAMEG_4581	Bacillus anthracis (strain CDC 684 / NRRL 3495)	607	lepA
C3LR06	reviewed	LEPA_VIBCM	Elongation factor 4 (EF-4) (EC 3.6.5.n1) (Ribosomal back-translocase LepA)	lepA VCM66_2386	Vibrio cholerae serotype O1 (strain M66-2)	597	lepA
C3P8M5	reviewed	LEPA_BACAA	Elongation factor 4 (EF-4) (EC 3.6.5.n1) (Ribosomal back-translocase LepA)	lepA BAA_4563	Bacillus anthracis (strain A0248)	607	lepA
C4L433	reviewed	LEPA_EXISA	Elongation factor 4 (EF-4) (EC 3.6.5.n1) (Ribosomal back-translocase LepA)	lepA EAT1b_0624	Exiguobacterium sp. (strain ATCC BAA-1283 / AT1b)	607	lepA
C4LBZ6	reviewed	LEPA_TOLAT	Elongation factor 4 (EF-4) (EC 3.6.5.n1) (Ribosomal back-translocase LepA)	lepA Tola_0847	Tolumonas auensis (strain DSM 9187 / TA4)	598	lepA
C6DC02	reviewed	LEPA_PECCP	Elongation factor 4 (EF-4) (EC 3.6.5.n1) (Ribosomal back-translocase LepA)	lepA PC1_3073	Pectobacterium carotovorum subsp. carotovorum (strain PC1)	599	lepA
C6DZ67	reviewed	LEPA_GEOSM	Elongation factor 4 (EF-4) (EC 3.6.5.n1) (Ribosomal back-translocase LepA)	lepA GM21_2327	Geobacter sp. (strain M21)	599	lepA
O83523	reviewed	LEPA_TREPA	Elongation factor 4 (EF-4) (EC 3.6.5.n1) (Ribosomal back-translocase LepA)	lepA TP_0510	Treponema pallidum (strain Nichols)	605	lepA
P43729	reviewed	LEPA_HAEIN	Elongation factor 4 (EF-4) (EC 3.6.5.n1) (Ribosomal back-translocase LepA)	lepA HI_0016	Haemophilus influenzae (strain ATCC 51907 / DSM 11121 / KW20 / Rd)	598	lepA
P60790	reviewed	LEPA_LACJO	Elongation factor 4 (EF-4) (EC 3.6.5.n1) (Ribosomal back-translocase LepA)	lepA LJ_1477	Lactobacillus johnsonii (strain CNCM I-12250 / La1 / NCC 533)	612	lepA
P60792	reviewed	LEPA_ONYPE	Elongation factor 4 (EF-4) (EC 3.6.5.n1) (Ribosomal back-translocase LepA)	lepA PAM_445	Onion yellows phytoplasma (strain OY-M)	605	lepA
P65270	reviewed	LEPA_MYCBO	Elongation factor 4 (EF-4) (EC 3.6.5.n1) (Ribosomal back-translocase LepA)	lepA BQ2027_MB2427C	Mycobacterium bovis (strain ATCC BAA-935 / AF2122/97)	653	lepA
Q03QU8	reviewed	LEPA_LEVBA	Elongation factor 4 (EF-4) (EC 3.6.5.n1) (Ribosomal back-translocase LepA)	lepA LVIS_1322	Levilactobacillus brevis (strain ATCC 367 / BCRC 12310 / CIP 105137 / JCM 1170 / LMG 11437 / NCIMB 947 / NCTC 947) (Lactobacillus brevis)	610	lepA
Q04KB7	reviewed	LEPA_STRP2	Elongation factor 4 (EF-4) (EC 3.6.5.n1) (Ribosomal back-translocase LepA)	lepA SPD_1060	Streptococcus pneumoniae serotype 2 (strain D39 / NCTC 7466)	607	lepA
Q0A8Z4	reviewed	LEPA_ALKEH	Elongation factor 4 (EF-4) (EC 3.6.5.n1) (Ribosomal back-translocase LepA)	lepA Mlg_1344	Alkalilimnicola ehrlichii (strain ATCC BAA-1101 / DSM 17681 / MLHE-1)	627	lepA
Q0AWL9	reviewed	LEPA_SYNWW	Elongation factor 4 (EF-4) (EC 3.6.5.n1) (Ribosomal back-translocase LepA)	lepA Swol_1583	Syntrophomonas wolfei subsp. wolfei (strain DSM 2245B / Goettingen)	599	lepA
Q0HG96	reviewed	LEPA_SHESM	Elongation factor 4 (EF-4) (EC 3.6.5.n1) (Ribosomal back-translocase LepA)	lepA Shewmr4_2850	Shewanella sp. (strain MR-4)	596	lepA
Q11UD0	reviewed	LEPA_CYTH3	Elongation factor 4 (EF-4) (EC 3.6.5.n1) (Ribosomal back-translocase LepA)	lepA CHU_1717	Cytophaga hutchinsonii (strain ATCC 33406 / DSM 1761 / CIP 103989 / NBRC 15051 / NCIMB 9469 / D465)	596	lepA
Q12KH9	reviewed	LEPA_SHEDO	Elongation factor 4 (EF-4) (EC 3.6.5.n1) (Ribosomal back-translocase LepA)	lepA Sden_2768	Shewanella denitrificans (strain OS217 / ATCC BAA-1090 / DSM 15013)	596	lepA
Q1D6M1	reviewed	LEPA_MYXXD	Elongation factor 4 (EF-4) (EC 3.6.5.n1) (Ribosomal back-translocase LepA)	lepA MXAN_3508	Myxococcus xanthus (strain DK1622)	603	lepA
Q1JC06	reviewed	LEPA_STRPB	Elongation factor 4 (EF-4) (EC 3.6.5.n1) (Ribosomal back-translocase LepA)	lepA MGAS2096_Spy0850	Streptococcus pyogenes serotype M12 (strain MGAS2096)	635	lepA
Q1JLY8	reviewed	LEPA_STRPC	Elongation factor 4 (EF-4) (EC 3.6.5.n1) (Ribosomal back-translocase LepA)	lepA MGAS9429_Spy0893	Streptococcus pyogenes serotype M12 (strain MGAS9429)	610	lepA
Q1QR19	reviewed	LEPA_NITHX	Elongation factor 4 (EF-4) (EC 3.6.5.n1) (Ribosomal back-translocase LepA)	lepA Nham_0438	Nitrobacter hamburgensis (strain DSM 10229 / NCIMB 13809 / X14)	610	lepA
Q21BS0	reviewed	LEPA_RHOPB	Elongation factor 4 (EF-4) (EC 3.6.5.n1) (Ribosomal back-translocase LepA)	lepA RPC_0591	Rhodopseudomonas palustris (strain BisB18)	601	lepA
Q2IIA6	reviewed	LEPA_ANADE	Elongation factor 4 (EF-4) (EC 3.6.5.n1) (Ribosomal back-translocase LepA)	lepA Adeh_1614	Anaeromyxobacter dehalogenans (strain 2CP-C)	601	lepA
Q2SL35	reviewed	LEPA_HAHCH	Elongation factor 4 (EF-4) (EC 3.6.5.n1) (Ribosomal back-translocase LepA)	lepA HCH_01797	Hahella chejuensis (strain KCTC 2396)	599	lepA
Q39I75	reviewed	LEPA_BURL3	Elongation factor 4 (EF-4) (EC 3.6.5.n1) (Ribosomal back-translocase LepA)	lepA Bcep18194_A4244	Burkholderia lata (strain ATCC 17760 / DSM 23089 / LMG 22485 / NCIMB 9086 / R18194 / 383)	597	lepA
Q3AF13	reviewed	LEPA_CARHZ	Elongation factor 4 (EF-4) (EC 3.6.5.n1) (Ribosomal back-translocase LepA)	lepA CHY_0410	Carboxydothermus hydrogenoformans (strain ATCC BAA-161 / DSM 6008 / Z-2901)	603	lepA
Q3SVT1	reviewed	LEPA_NITWN	Elongation factor 4 (EF-4) (EC 3.6.5.n1) (Ribosomal back-translocase LepA)	lepA Nwi_0343	Nitrobacter winogradskyi (strain ATCC 25391 / DSM 10237 / CIP 104748 / NCIMB 11846 / Nb-255)	603	lepA
Q3YYU7	reviewed	LEPA_SHISS	Elongation factor 4 (EF-4) (EC 3.6.5.n1) (Ribosomal back-translocase LepA)	lepA SSON_2693	Shigella sonnei (strain Ss046)	599	lepA
Q4A8T9	reviewed	LEPA_MESH7	Elongation factor 4 (EF-4) (EC 3.6.5.n1) (Ribosomal back-translocase LepA)	lepA MHP7448_0073	Mesomycoplasma hyopneumoniae (strain 7448) (Mycoplasma hyopneumoniae)	598	lepA
Q4KHT3	reviewed	LEPA_PSEF5	Elongation factor 4 (EF-4) (EC 3.6.5.n1) (Ribosomal back-translocase LepA)	lepA PFL_1069	Pseudomonas fluorescens (strain ATCC BAA-477 / NRRL B-23932 / Pf-5)	599	lepA
Q4UKS2	reviewed	LEPA_RICFE	Elongation factor 4 (EF-4) (EC 3.6.5.n1) (Ribosomal back-translocase LepA)	lepA RF_1000	Rickettsia felis (strain ATCC VR-1525 / URRWXCal2) (Rickettsia azadi)	600	lepA
Q57LC8	reviewed	LEPA_SALCH	Elongation factor 4 (EF-4) (EC 3.6.5.n1) (Ribosomal back-translocase LepA)	lepA SCH_2578	Salmonella choleraesuis (strain SC-B67)	599	lepA
Q5NEF8	reviewed	LEPA_FRATT	Elongation factor 4 (EF-4) (EC 3.6.5.n1) (Ribosomal back-translocase LepA)	lepA FTT_1678c	Francisella tularensis subsp. tularensis (strain SCHU S4 / Schu 4)	594	lepA
Q6MTR6	reviewed	LEPA_MYCMS	Elongation factor 4 (EF-4) (EC 3.6.5.n1) (Ribosomal back-translocase LepA)	lepA MSC_0330	Mycoplasma mycoides subsp. mycoides SC (strain PG1)	600	lepA
Q72E76	reviewed	LEPA_DESVH	Elongation factor 4 (EF-4) (EC 3.6.5.n1) (Ribosomal back-translocase LepA)	lepA DVU_0703	Desulfovibrio vulgaris (strain ATCC 29579 / DSM 644 / NCIMB 8303 / VKM B-1760 / Hildenborough)	601	lepA
Q831Z0	reviewed	LEPA_ENTFA	Elongation factor 4 (EF-4) (EC 3.6.5.n1) (Ribosomal back-translocase LepA)	lepA EF_2352	Enterococcus faecalis (strain ATCC 700802 / V583)	611	lepA
Q87C09	reviewed	LEPA_XYLFT	Elongation factor 4 (EF-4) (EC 3.6.5.n1) (Ribosomal back-translocase LepA)	lepA PD_1287	Xylella fastidiosa (strain Temecula1 / ATCC 700964)	602	lepA
Q87XF8	reviewed	LEPA_PSESM	Elongation factor 4 (EF-4) (EC 3.6.5.n1) (Ribosomal back-translocase LepA)	lepA PSPTO_4220	Pseudomonas syringae pv. tomato (strain ATCC BAA-871 / DC3000)	595	lepA
Q892Q6	reviewed	LEPA_CLOTE	Elongation factor 4 (EF-4) (EC 3.6.5.n1) (Ribosomal back-translocase LepA)	lepA CTC_02035	Clostridium tetani (strain Massachusetts / E88)	602	lepA
Q89AM5	reviewed	LEPA_BUCBP	Elongation factor 4 (EF-4) (EC 3.6.5.n1) (Ribosomal back-translocase LepA)	lepA bbp_241	Buchnera aphidicola subsp. Baizongia pistaciae (strain Bp)	595	lepA
Q8AA33	reviewed	LEPA_BACTN	Elongation factor 4 (EF-4) (EC 3.6.5.n1) (Ribosomal back-translocase LepA)	lepA BT_0632	Bacteroides thetaiotaomicron (strain ATCC 29148 / DSM 2079 / JCM 5827 / CCUG 10774 / NCTC 10582 / VPI-5482 / E50)	593	lepA
Q8DTF3	reviewed	LEPA_STRMU	Elongation factor 4 (EF-4) (EC 3.6.5.n1) (Ribosomal back-translocase LepA)	lepA SMU_1394	Streptococcus mutans serotype c (strain ATCC 700610 / UA159)	611	lepA
Q9CGI8	reviewed	LEPA_LACLA	Elongation factor 4 (EF-4) (EC 3.6.5.n1) (Ribosomal back-translocase LepA)	lepA LL1108 L0159	Lactococcus lactis subsp. lactis (strain IL1403) (Streptococcus lactis)	607	lepA
Q9X1V8	reviewed	LEPA_THEMA	Elongation factor 4 (EF-4) (EC 3.6.5.n1) (Ribosomal back-translocase LepA)	lepA TM_1623	Thermotoga maritima (strain ATCC 43589 / DSM 3109 / JCM 10099 / NBRC 100826 / MSB8)	621	lepA
Q9ZM93	reviewed	LEPA_HELPJ	Elongation factor 4 (EF-4) (EC 3.6.5.n1) (Ribosomal back-translocase LepA)	lepA jhp_0329	Helicobacter pylori (strain J99 / ATCC 700824) (Campylobacter pylori J99)	604	lepA
A5K6I6	reviewed	GUF1_PLAVS	Translation factor GUF1 homolog, mitochondrial (EC 3.6.5.-) (Elongation factor 4 homolog) (EF-4) (GTPase GUF1 homolog) (Ribosomal back-translocase)	PVX_099025	Plasmodium vivax (strain Salvador I)	910	
B8BYH3	reviewed	GUF1_THAPS	Translation factor GUF1 homolog, mitochondrial (EC 3.6.5.-) (Elongation factor 4 homolog) (EF-4) (GTPase GUF1 homolog) (Ribosomal back-translocase)	THAPSDRAFT_40001	Thalassiosira pseudonana (Marine diatom) (Cyclotella nana)	706	
A0JX50	reviewed	LEPA_ARTS2	Elongation factor 4 (EF-4) (EC 3.6.5.n1) (Ribosomal back-translocase LepA)	lepA Arth_2240	Arthrobacter sp. (strain FB24)	617	lepA
A0Q453	reviewed	LEPA_FRATN	Elongation factor 4 (EF-4) (EC 3.6.5.n1) (Ribosomal back-translocase LepA)	lepA FTN_0107	Francisella tularensis subsp. novicida (strain U112)	594	lepA
A1ARG8	reviewed	LEPA_PELPD	Elongation factor 4 (EF-4) (EC 3.6.5.n1) (Ribosomal back-translocase LepA)	lepA Ppro_2331	Pelobacter propionicus (strain DSM 2379 / NBRC 103807 / OttBd1)	598	lepA
A1U2V8	reviewed	LEPA_MARN8	Elongation factor 4 (EF-4) (EC 3.6.5.n1) (Ribosomal back-translocase LepA)	lepA Maqu_2248	Marinobacter nauticus (strain ATCC 700491 / DSM 11845 / VT8) (Marinobacter aquaeolei)	600	lepA
A2S9Z3	reviewed	LEPA_BURM9	Elongation factor 4 (EF-4) (EC 3.6.5.n1) (Ribosomal back-translocase LepA)	lepA BMA10229_A2813	Burkholderia mallei (strain NCTC 10229)	597	lepA
A3MM44	reviewed	LEPA_BURM7	Elongation factor 4 (EF-4) (EC 3.6.5.n1) (Ribosomal back-translocase LepA)	lepA BMA10247_1791	Burkholderia mallei (strain NCTC 10247)	597	lepA
A4IR35	reviewed	LEPA_GEOTN	Elongation factor 4 (EF-4) (EC 3.6.5.n1) (Ribosomal back-translocase LepA)	lepA GTNG_2444	Geobacillus thermodenitrificans (strain NG80-2)	609	lepA
A4SFN5	reviewed	LEPA_CHLPM	Elongation factor 4 (EF-4) (EC 3.6.5.n1) (Ribosomal back-translocase LepA)	lepA Cvib_1282	Chlorobium phaeovibrioides (strain DSM 265 / 1930) (Prosthecochloris vibrioformis (strain DSM 265))	605	lepA
A4SRD4	reviewed	LEPA_AERS4	Elongation factor 4 (EF-4) (EC 3.6.5.n1) (Ribosomal back-translocase LepA)	lepA ASA_3488	Aeromonas salmonicida (strain A449)	597	lepA
A4SVW0	reviewed	LEPA_POLAQ	Elongation factor 4 (EF-4) (EC 3.6.5.n1) (Ribosomal back-translocase LepA)	lepA Pnuc_0404	Polynucleobacter asymbioticus (strain DSM 18221 / CIP 109841 / QLW-P1DMWA-1) (Polynucleobacter necessarius subsp. asymbioticus)	601	lepA
A4VUL8	reviewed	LEPA_STRSY	Elongation factor 4 (EF-4) (EC 3.6.5.n1) (Ribosomal back-translocase LepA)	lepA SSU05_0841	Streptococcus suis (strain 05ZYH33)	610	lepA
A5G4G3	reviewed	LEPA_GEOUR	Elongation factor 4 (EF-4) (EC 3.6.5.n1) (Ribosomal back-translocase LepA)	lepA Gura_2503	Geotalea uraniireducens (strain Rf4) (Geobacter uraniireducens)	599	lepA
A5VVU4	reviewed	LEPA_BRUO2	Elongation factor 4 (EF-4) (EC 3.6.5.n1) (Ribosomal back-translocase LepA)	lepA BOV_A0979	Brucella ovis (strain ATCC 25840 / 63/290 / NCTC 10512)	602	lepA
A6LC18	reviewed	LEPA_PARD8	Elongation factor 4 (EF-4) (EC 3.6.5.n1) (Ribosomal back-translocase LepA)	lepA BDI_1475	Parabacteroides distasonis (strain ATCC 8503 / DSM 20701 / CIP 104284 / JCM 5825 / NCTC 11152)	595	lepA
A6QHC7	reviewed	LEPA_STAAE	Elongation factor 4 (EF-4) (EC 3.6.5.n1) (Ribosomal back-translocase LepA)	lepA NWMN_1487	Staphylococcus aureus (strain Newman)	607	lepA
A6SXR0	reviewed	LEPA_JANMA	Elongation factor 4 (EF-4) (EC 3.6.5.n1) (Ribosomal back-translocase LepA)	lepA mma_1367	Janthinobacterium sp. (strain Marseille) (Minibacterium massiliensis)	597	lepA
A6U257	reviewed	LEPA_STAA2	Elongation factor 4 (EF-4) (EC 3.6.5.n1) (Ribosomal back-translocase LepA)	lepA SaurJH1_1677	Staphylococcus aureus (strain JH1)	607	lepA
A6WKQ5	reviewed	LEPA_SHEB8	Elongation factor 4 (EF-4) (EC 3.6.5.n1) (Ribosomal back-translocase LepA)	lepA Shew185_1243	Shewanella baltica (strain OS185)	596	lepA
A7FXL9	reviewed	LEPA_CLOB1	Elongation factor 4 (EF-4) (EC 3.6.5.n1) (Ribosomal back-translocase LepA)	lepA CLB_2927	Clostridium botulinum (strain ATCC 19397 / Type A)	602	lepA
A8FM79	reviewed	LEPA_CAMJ8	Elongation factor 4 (EF-4) (EC 3.6.5.n1) (Ribosomal back-translocase LepA)	lepA C8J_0967	Campylobacter jejuni subsp. jejuni serotype O:6 (strain 81116 / NCTC 11828)	598	lepA
A8GI27	reviewed	LEPA_SERP5	Elongation factor 4 (EF-4) (EC 3.6.5.n1) (Ribosomal back-translocase LepA)	lepA Spro_3671	Serratia proteamaculans (strain 568)	598	lepA
A8GMT1	reviewed	LEPA_RICAH	Elongation factor 4 (EF-4) (EC 3.6.5.n1) (Ribosomal back-translocase LepA)	lepA A1C_01975	Rickettsia akari (strain Hartford)	600	lepA
A8GW16	reviewed	LEPA_RICB8	Elongation factor 4 (EF-4) (EC 3.6.5.n1) (Ribosomal back-translocase LepA)	lepA A1I_03420	Rickettsia bellii (strain OSU 85-389)	600	lepA
A8H1C5	reviewed	LEPA_SHEPA	Elongation factor 4 (EF-4) (EC 3.6.5.n1) (Ribosomal back-translocase LepA)	lepA Spea_1035	Shewanella pealeana (strain ATCC 700345 / ANG-SQ1)	596	lepA
A8YVQ1	reviewed	LEPA_LACH4	Elongation factor 4 (EF-4) (EC 3.6.5.n1) (Ribosomal back-translocase LepA)	lepA lhv_1332	Lactobacillus helveticus (strain DPC 4571)	612	lepA
A9BNJ8	reviewed	LEPA_DELAS	Elongation factor 4 (EF-4) (EC 3.6.5.n1) (Ribosomal back-translocase LepA)	lepA Daci_5264	Delftia acidovorans (strain DSM 14801 / SPH-1)	602	lepA
A9L5N4	reviewed	LEPA_SHEB9	Elongation factor 4 (EF-4) (EC 3.6.5.n1) (Ribosomal back-translocase LepA)	lepA Sbal195_1276	Shewanella baltica (strain OS195)	596	lepA
A9M3J8	reviewed	LEPA_NEIM0	Elongation factor 4 (EF-4) (EC 3.6.5.n1) (Ribosomal back-translocase LepA)	lepA NMCC_0730	Neisseria meningitidis serogroup C (strain 053442)	597	lepA
B0S8S7	reviewed	LEPA_LEPBA	Elongation factor 4 (EF-4) (EC 3.6.5.n1) (Ribosomal back-translocase LepA)	lepA LBF_1651	Leptospira biflexa serovar Patoc (strain Patoc 1 / Ames)	601	lepA
B0SRL4	reviewed	LEPA_LEPBP	Elongation factor 4 (EF-4) (EC 3.6.5.n1) (Ribosomal back-translocase LepA)	lepA LEPBI_I1703	Leptospira biflexa serovar Patoc (strain Patoc 1 / ATCC 23582 / Paris)	601	lepA
B1AIW2	reviewed	LEPA_UREP2	Elongation factor 4 (EF-4) (EC 3.6.5.n1) (Ribosomal back-translocase LepA)	lepA UPA3_0339	Ureaplasma parvum serovar 3 (strain ATCC 27815 / 27 / NCTC 11736)	599	lepA
B1ILM7	reviewed	LEPA_CLOBK	Elongation factor 4 (EF-4) (EC 3.6.5.n1) (Ribosomal back-translocase LepA)	lepA CLD_1582	Clostridium botulinum (strain Okra / Type B1)	602	lepA
B1IVQ8	reviewed	LEPA_ECOLC	Elongation factor 4 (EF-4) (EC 3.6.5.n1) (Ribosomal back-translocase LepA)	lepA EcolC_1108	Escherichia coli (strain ATCC 8739 / DSM 1576 / NBRC 3972 / NCIMB 8545 / WDCM 00012 / Crooks)	599	lepA
B1J4D8	reviewed	LEPA_PSEPW	Elongation factor 4 (EF-4) (EC 3.6.5.n1) (Ribosomal back-translocase LepA)	lepA PputW619_1071	Pseudomonas putida (strain W619)	599	lepA
B1XB43	reviewed	LEPA_ECODH	Elongation factor 4 (EF-4) (EC 3.6.5.n1) (Ribosomal back-translocase LepA)	lepA ECDH10B_2737	Escherichia coli (strain K12 / DH10B)	599	lepA
B2KA49	reviewed	LEPA_YERPB	Elongation factor 4 (EF-4) (EC 3.6.5.n1) (Ribosomal back-translocase LepA)	lepA YPTS_3003	Yersinia pseudotuberculosis serotype IB (strain PB1/+)	599	lepA
B2RKK1	reviewed	LEPA_PORG3	Elongation factor 4 (EF-4) (EC 3.6.5.n1) (Ribosomal back-translocase LepA)	lepA PGN_1377	Porphyromonas gingivalis (strain ATCC 33277 / DSM 20709 / CIP 103683 / JCM 12257 / NCTC 11834 / 2561)	595	lepA
B2SRY0	reviewed	LEPA_XANOP	Elongation factor 4 (EF-4) (EC 3.6.5.n1) (Ribosomal back-translocase LepA)	lepA PXO_01714	Xanthomonas oryzae pv. oryzae (strain PXO99A)	596	lepA
B2TYI0	reviewed	LEPA_SHIB3	Elongation factor 4 (EF-4) (EC 3.6.5.n1) (Ribosomal back-translocase LepA)	lepA SbBS512_E2934	Shigella boydii serotype 18 (strain CDC 3083-94 / BS512)	599	lepA
B2USI5	reviewed	LEPA_HELPS	Elongation factor 4 (EF-4) (EC 3.6.5.n1) (Ribosomal back-translocase LepA)	lepA HPSH_01835	Helicobacter pylori (strain Shi470)	602	lepA
B2VI44	reviewed	LEPA_ERWT9	Elongation factor 4 (EF-4) (EC 3.6.5.n1) (Ribosomal back-translocase LepA)	lepA ETA_09900	Erwinia tasmaniensis (strain DSM 17950 / CFBP 7177 / CIP 109463 / NCPPB 4357 / Et1/99)	599	lepA
B3WEQ5	reviewed	LEPA_LACCB	Elongation factor 4 (EF-4) (EC 3.6.5.n1) (Ribosomal back-translocase LepA)	lepA LCABL_17760	Lacticaseibacillus casei (strain BL23) (Lactobacillus casei)	612	lepA
B4RVA8	reviewed	LEPA_ALTMD	Elongation factor 4 (EF-4) (EC 3.6.5.n1) (Ribosomal back-translocase LepA)	lepA MADE_1012525	Alteromonas mediterranea (strain DSM 17117 / CIP 110805 / LMG 28347 / Deep ecotype)	598	lepA
B4TE17	reviewed	LEPA_SALHS	Elongation factor 4 (EF-4) (EC 3.6.5.n1) (Ribosomal back-translocase LepA)	lepA SeHA_C2850	Salmonella heidelberg (strain SL476)	599	lepA
B4U3G9	reviewed	LEPA_STREM	Elongation factor 4 (EF-4) (EC 3.6.5.n1) (Ribosomal back-translocase LepA)	lepA Sez_1191	Streptococcus equi subsp. zooepidemicus (strain MGCS10565)	610	lepA
B5F1G3	reviewed	LEPA_SALA4	Elongation factor 4 (EF-4) (EC 3.6.5.n1) (Ribosomal back-translocase LepA)	lepA SeAg_B2746	Salmonella agona (strain SL483)	599	lepA
B5FAH2	reviewed	LEPA_ALIFM	Elongation factor 4 (EF-4) (EC 3.6.5.n1) (Ribosomal back-translocase LepA)	lepA VFMJ11_2194	Aliivibrio fischeri (strain MJ11) (Vibrio fischeri)	597	lepA
B5XNG8	reviewed	LEPA_KLEP3	Elongation factor 4 (EF-4) (EC 3.6.5.n1) (Ribosomal back-translocase LepA)	lepA KPK_1228	Klebsiella pneumoniae (strain 342)	599	lepA
B5ZAB8	reviewed	LEPA_HELPG	Elongation factor 4 (EF-4) (EC 3.6.5.n1) (Ribosomal back-translocase LepA)	lepA HPG27_332	Helicobacter pylori (strain G27)	602	lepA
B5ZBD4	reviewed	LEPA_UREU1	Elongation factor 4 (EF-4) (EC 3.6.5.n1) (Ribosomal back-translocase LepA)	lepA UUR10_0331	Ureaplasma urealyticum serovar 10 (strain ATCC 33699 / Western)	599	lepA
B6EKN1	reviewed	LEPA_ALISL	Elongation factor 4 (EF-4) (EC 3.6.5.n1) (Ribosomal back-translocase LepA)	lepA VSAL_I2527	Aliivibrio salmonicida (strain LFI1238) (Vibrio salmonicida (strain LFI1238))	597	lepA
B7GKC4	reviewed	LEPA_ANOFW	Elongation factor 4 (EF-4) (EC 3.6.5.n1) (Ribosomal back-translocase LepA)	lepA Aflv_0831	Anoxybacillus flavithermus (strain DSM 21510 / WK1)	608	lepA
B7JNV1	reviewed	LEPA_BACC0	Elongation factor 4 (EF-4) (EC 3.6.5.n1) (Ribosomal back-translocase LepA)	lepA BCAH820_4341	Bacillus cereus (strain AH820)	607	lepA
B7MIQ4	reviewed	LEPA_ECO45	Elongation factor 4 (EF-4) (EC 3.6.5.n1) (Ribosomal back-translocase LepA)	lepA ECS88_2743	Escherichia coli O45:K1 (strain S88 / ExPEC)	599	lepA
B7UH09	reviewed	LEPA_ECO27	Elongation factor 4 (EF-4) (EC 3.6.5.n1) (Ribosomal back-translocase LepA)	lepA E2348C_2846	Escherichia coli O127:H6 (strain E2348/69 / EPEC)	599	lepA
B7UYX5	reviewed	LEPA_PSEA8	Elongation factor 4 (EF-4) (EC 3.6.5.n1) (Ribosomal back-translocase LepA)	lepA PLES_45761	Pseudomonas aeruginosa (strain LESB58)	599	lepA
C0PYG5	reviewed	LEPA_SALPC	Elongation factor 4 (EF-4) (EC 3.6.5.n1) (Ribosomal back-translocase LepA)	lepA SPC_1066	Salmonella paratyphi C (strain RKS4594)	599	lepA
C1CR98	reviewed	LEPA_STRZT	Elongation factor 4 (EF-4) (EC 3.6.5.n1) (Ribosomal back-translocase LepA)	lepA SPT_1026	Streptococcus pneumoniae (strain Taiwan19F-14)	607	lepA
C1D7L2	reviewed	LEPA_LARHH	Elongation factor 4 (EF-4) (EC 3.6.5.n1) (Ribosomal back-translocase LepA)	lepA LHK_01463	Laribacter hongkongensis (strain HLHK9)	597	lepA
C1ESL3	reviewed	LEPA_BACC3	Elongation factor 4 (EF-4) (EC 3.6.5.n1) (Ribosomal back-translocase LepA)	lepA BCA_4430	Bacillus cereus (strain 03BB102)	607	lepA
C1KVC6	reviewed	LEPA_LISMC	Elongation factor 4 (EF-4) (EC 3.6.5.n1) (Ribosomal back-translocase LepA)	lepA Lm4b_01489	Listeria monocytogenes serotype 4b (strain CLIP80459)	608	lepA
C3PMX3	reviewed	LEPA_RICAE	Elongation factor 4 (EF-4) (EC 3.6.5.n1) (Ribosomal back-translocase LepA)	lepA RAF_ORF0344	Rickettsia africae (strain ESF-5)	600	lepA
C4Z9E3	reviewed	LEPA_AGARV	Elongation factor 4 (EF-4) (EC 3.6.5.n1) (Ribosomal back-translocase LepA)	lepA EUBREC_1621	Agathobacter rectalis (strain ATCC 33656 / DSM 3377 / JCM 17463 / KCTC 5835 / VPI 0990) (Eubacterium rectale)	603	lepA
Q0I4Z1	reviewed	LEPA_HISS1	Elongation factor 4 (EF-4) (EC 3.6.5.n1) (Ribosomal back-translocase LepA)	lepA HS_1242	Histophilus somni (strain 129Pt) (Haemophilus somnus)	598	lepA
Q0SRD8	reviewed	LEPA_CLOPS	Elongation factor 4 (EF-4) (EC 3.6.5.n1) (Ribosomal back-translocase LepA)	lepA CPR_2010	Clostridium perfringens (strain SM101 / Type A)	600	lepA
Q17X87	reviewed	LEPA_HELAH	Elongation factor 4 (EF-4) (EC 3.6.5.n1) (Ribosomal back-translocase LepA)	lepA Hac_0967	Helicobacter acinonychis (strain Sheeba)	604	lepA
Q1CUF5	reviewed	LEPA_HELPH	Elongation factor 4 (EF-4) (EC 3.6.5.n1) (Ribosomal back-translocase LepA)	lepA HPAG1_0350	Helicobacter pylori (strain HPAG1)	602	lepA
Q1IV51	reviewed	LEPA_KORVE	Elongation factor 4 (EF-4) (EC 3.6.5.n1) (Ribosomal back-translocase LepA)	lepA Acid345_0244	Koribacter versatilis (strain Ellin345)	601	lepA
Q1IXW5	reviewed	LEPA_DEIGD	Elongation factor 4 (EF-4) (EC 3.6.5.n1) (Ribosomal back-translocase LepA)	lepA Dgeo_1624	Deinococcus geothermalis (strain DSM 11300 / AG-3a)	595	lepA
Q1R8G3	reviewed	LEPA_ECOUT	Elongation factor 4 (EF-4) (EC 3.6.5.n1) (Ribosomal back-translocase LepA)	lepA UTI89_C2891	Escherichia coli (strain UTI89 / UPEC)	599	lepA
Q28LR4	reviewed	LEPA_JANSC	Elongation factor 4 (EF-4) (EC 3.6.5.n1) (Ribosomal back-translocase LepA)	lepA Jann_3431	Jannaschia sp. (strain CCS1)	599	lepA
Q2NJE6	reviewed	LEPA_AYWBP	Elongation factor 4 (EF-4) (EC 3.6.5.n1) (Ribosomal back-translocase LepA)	lepA AYWB_330	Aster yellows witches'-broom phytoplasma (strain AYWB)	605	lepA
Q2RKX8	reviewed	LEPA_MOOTA	Elongation factor 4 (EF-4) (EC 3.6.5.n1) (Ribosomal back-translocase LepA)	lepA Moth_0581	Moorella thermoacetica (strain ATCC 39073 / JCM 9320)	602	lepA
Q2SSF7	reviewed	LEPA_MYCCT	Elongation factor 4 (EF-4) (EC 3.6.5.n1) (Ribosomal back-translocase LepA)	lepA MCAP_0321	Mycoplasma capricolum subsp. capricolum (strain California kid / ATCC 27343 / NCTC 10154)	600	lepA
Q2SXT6	reviewed	LEPA_BURTA	Elongation factor 4 (EF-4) (EC 3.6.5.n1) (Ribosomal back-translocase LepA)	lepA BTH_I1728	Burkholderia thailandensis (strain ATCC 700388 / DSM 13276 / CCUG 48851 / CIP 106301 / E264)	597	lepA
Q38W39	reviewed	LEPA_LATSS	Elongation factor 4 (EF-4) (EC 3.6.5.n1) (Ribosomal back-translocase LepA)	lepA LCA_1290	Latilactobacillus sakei subsp. sakei (strain 23K) (Lactobacillus sakei subsp. sakei)	612	lepA
Q39US7	reviewed	LEPA_GEOMG	Elongation factor 4 (EF-4) (EC 3.6.5.n1) (Ribosomal back-translocase LepA)	lepA Gmet_1766	Geobacter metallireducens (strain ATCC 53774 / DSM 7210 / GS-15)	599	lepA
Q3ATB2	reviewed	LEPA_CHLCH	Elongation factor 4 (EF-4) (EC 3.6.5.n1) (Ribosomal back-translocase LepA)	lepA Cag_0490	Chlorobium chlorochromatii (strain CaD3)	605	lepA
Q3J8D2	reviewed	LEPA_NITOC	Elongation factor 4 (EF-4) (EC 3.6.5.n1) (Ribosomal back-translocase LepA)	lepA Noc_2461	Nitrosococcus oceani (strain ATCC 19707 / BCRC 17464 / JCM 30415 / NCIMB 11848 / C-107)	606	lepA
Q3K1F9	reviewed	LEPA_STRA1	Elongation factor 4 (EF-4) (EC 3.6.5.n1) (Ribosomal back-translocase LepA)	lepA SAK_1022	Streptococcus agalactiae serotype Ia (strain ATCC 27591 / A909 / CDC SS700)	610	lepA
Q3SH47	reviewed	LEPA_THIDA	Elongation factor 4 (EF-4) (EC 3.6.5.n1) (Ribosomal back-translocase LepA)	lepA Tbd_2089	Thiobacillus denitrificans (strain ATCC 25259)	599	lepA
Q3YSC2	reviewed	LEPA_EHRCJ	Elongation factor 4 (EF-4) (EC 3.6.5.n1) (Ribosomal back-translocase LepA)	lepA Ecaj_0340	Ehrlichia canis (strain Jake)	598	lepA
Q47EG0	reviewed	LEPA_DECAR	Elongation factor 4 (EF-4) (EC 3.6.5.n1) (Ribosomal back-translocase LepA)	lepA Daro_2026	Dechloromonas aromatica (strain RCB)	596	lepA
Q47WP3	reviewed	LEPA_COLP3	Elongation factor 4 (EF-4) (EC 3.6.5.n1) (Ribosomal back-translocase LepA)	lepA CPS_4124	Colwellia psychrerythraea (strain 34H / ATCC BAA-681) (Vibrio psychroerythus)	596	lepA
Q48TU0	reviewed	LEPA_STRPM	Elongation factor 4 (EF-4) (EC 3.6.5.n1) (Ribosomal back-translocase LepA)	lepA M28_Spy0753	Streptococcus pyogenes serotype M28 (strain MGAS6180)	610	lepA
Q4FUV9	reviewed	LEPA_PSYA2	Elongation factor 4 (EF-4) (EC 3.6.5.n1) (Ribosomal back-translocase LepA)	lepA Psyc_0330	Psychrobacter arcticus (strain DSM 17307 / VKM B-2377 / 273-4)	598	lepA
Q5XCD2	reviewed	LEPA_STRP6	Elongation factor 4 (EF-4) (EC 3.6.5.n1) (Ribosomal back-translocase LepA)	lepA M6_Spy0796	Streptococcus pyogenes serotype M6 (strain ATCC BAA-946 / MGAS10394)	610	lepA
Q730L6	reviewed	LEPA_BACC1	Elongation factor 4 (EF-4) (EC 3.6.5.n1) (Ribosomal back-translocase LepA)	lepA BCE_4400	Bacillus cereus (strain ATCC 10987 / NRS 248)	607	lepA
Q73HR8	reviewed	LEPA_WOLPM	Elongation factor 4 (EF-4) (EC 3.6.5.n1) (Ribosomal back-translocase LepA)	lepA WD_0477	Wolbachia pipientis wMel	598	lepA
Q7MV56	reviewed	LEPA_PORGI	Elongation factor 4 (EF-4) (EC 3.6.5.n1) (Ribosomal back-translocase LepA)	lepA PG_1241	Porphyromonas gingivalis (strain ATCC BAA-308 / W83)	595	lepA
